{"canonicalization_backend":"jcs-rfc8785","canonicalization_version":"yaml-v1,md-v1","claude_cli_version":"0.8.1","diff_context":null,"emitted_at":"2025-12-05T23:31:14.190178600Z","error_kind":null,"error_reason":null,"exit_code":0,"fallback_used":false,"flags":{"phase":"design"},"llm":{"model_used":"haiku","provider":"claude-cli","timed_out":false},"model_alias":null,"model_full_name":"haiku","outputs":[{"blake3_canonicalized":"6139116b0c3970820d555be0e1f24f2b32a9da9c2b5391dfe15df47a3084cfbc","path":"artifacts/10-design.core.yaml"},{"blake3_canonicalized":"8049b566f8951b6451200bc7495b7ccbd439dd3c99bbb6622bc6c7a9be77de78","path":"artifacts/10-design.md"}],"packet":{"files":[],"max_bytes":65536,"max_lines":1200},"phase":"design","pipeline":{"execution_strategy":"controlled"},"runner":"native","runner_distro":null,"schema_version":"1","spec_id":"demo-time-api","stderr_redacted":null,"stderr_tail":null,"warnings":[],"xchecker_version":"1.0.0"}