{"canonicalization_backend":"jcs-rfc8785","canonicalization_version":"yaml-v1,md-v1","claude_cli_version":"0.8.1","diff_context":null,"emitted_at":"2025-01-01T00:00:00Z","error_kind":null,"error_reason":null,"exit_code":0,"fallback_used":null,"flags":{},"llm":null,"model_alias":null,"model_full_name":"haiku","outputs":[],"packet":{"files":[],"max_bytes":100000,"max_lines":5000},"phase":"requirements","pipeline":null,"runner":"native","runner_distro":null,"schema_version":"1","spec_id":"example-spec","stderr_redacted":null,"stderr_tail":null,"warnings":[],"xchecker_version":"0.1.0"}