{"canonicalization_backend":"jcs-rfc8785","canonicalization_version":"yaml-v1,md-v1","claude_cli_version":"0.8.1","diff_context":3,"emitted_at":"2025-01-01T00:00:00Z","error_kind":null,"error_reason":"Warning: large packet","exit_code":0,"fallback_used":true,"flags":{"dry_run":"true","strict_lock":"false"},"llm":{"model_used":"haiku","provider":"claude-cli","timed_out":false,"timeout_seconds":600,"tokens_input":1234,"tokens_output":567},"model_alias":"sonnet","model_full_name":"haiku","outputs":[{"blake3_canonicalized":"abc1234567890abcabc1234567890abcabc1234567890abcabc1234567890abc","path":"artifacts/00-requirements.md"},{"blake3_canonicalized":"fedcba9876543210fedcba9876543210fedcba9876543210fedcba9876543210","path":"artifacts/10-design.md"}],"packet":{"files":[{"blake3_pre_redaction":"abcdef1234567890abcdef1234567890abcdef1234567890abcdef1234567890","path":"README.md","priority":"Medium","range":null},{"blake3_pre_redaction":"1234567890abcdef1234567890abcdef1234567890abcdef1234567890abcdef","path":"specs/example-spec/requirements.md","priority":"High","range":"L1-L80"}],"max_bytes":100000,"max_lines":5000},"phase":"design","pipeline":{"execution_strategy":"controlled"},"runner":"wsl","runner_distro":"Ubuntu-22.04","schema_version":"1","spec_id":"example-spec","stderr_redacted":"Warning: packet size approaching limit (secrets redacted)","stderr_tail":"Warning: packet size approaching limit","warnings":["rename_retry_count: 2"],"xchecker_version":"0.1.0"}