{"canonicalization_backend":"jcs-rfc8785","canonicalization_version":"yaml-v1,md-v1","claude_cli_version":"0.8.1","diff_context":null,"emitted_at":"2025-12-05T23:32:22.162838500Z","error_kind":null,"error_reason":null,"exit_code":0,"fallback_used":false,"flags":{"phase":"tasks"},"llm":{"model_used":"haiku","provider":"claude-cli","timed_out":false},"model_alias":null,"model_full_name":"haiku","outputs":[{"blake3_canonicalized":"9aa72a7f4c135baa5046cad8d95b4f8b1aff81b83232266f0597d4a33d32946a","path":"artifacts/20-tasks.core.yaml"},{"blake3_canonicalized":"f348b2b67d117944f535b966def26f1f7b9116a4d58bc80b2fa7252052772f36","path":"artifacts/20-tasks.md"}],"packet":{"files":[],"max_bytes":65536,"max_lines":1200},"phase":"tasks","pipeline":{"execution_strategy":"controlled"},"runner":"native","runner_distro":null,"schema_version":"1","spec_id":"demo-time-api","stderr_redacted":null,"stderr_tail":null,"warnings":[],"xchecker_version":"1.0.0"}