{"canonicalization_backend":"jcs-rfc8785","canonicalization_version":"yaml-v1,md-v1","claude_cli_version":"0.8.1","diff_context":null,"emitted_at":"2025-12-05T23:29:01.630105900Z","error_kind":null,"error_reason":null,"exit_code":0,"fallback_used":false,"flags":{"phase":"requirements"},"llm":{"model_used":"haiku","provider":"claude-cli","timed_out":false},"model_alias":null,"model_full_name":"haiku","outputs":[{"blake3_canonicalized":"af19f28fa1992d5ad3a7e84cd60594eafd7997d70c4f7172095fe0459a5a90be","path":"artifacts/00-requirements.core.yaml"},{"blake3_canonicalized":"4fdaf7339f8112ed27d5419247c791990260c03d1955657a9fd6e09079e5fecb","path":"artifacts/00-requirements.md"}],"packet":{"files":[],"max_bytes":65536,"max_lines":1200},"phase":"requirements","pipeline":{"execution_strategy":"controlled"},"runner":"native","runner_distro":null,"schema_version":"1","spec_id":"demo-time-api","stderr_redacted":null,"stderr_tail":null,"warnings":[],"xchecker_version":"1.0.0"}